{
  "id": "deepseek",
  "name": "DeepSeek Chat",
  "type": "webui",
  "interface": "browser",
  "strengths": [],
  "weaknesses": [],
  "best_for": [],
  "avoid_for": [],
  "cost": { "tier": "free", "notes": "" },
  "capabilities": {
    "file_access": false,
    "code_execution": false,
    "web_search": true,
    "image_input": false,
    "image_generation": false,
    "long_documents": false
  },
  "updated_at": "2026-02-28T00:00:00Z"
}
