{
  "id": "gemini",
  "name": "Google Gemini 3.1 Pro",
  "type": "webui",
  "interface": "browser",
  "strengths": [],
  "weaknesses": [],
  "best_for": [],
  "avoid_for": [],
  "cost": { "tier": "free", "notes": "" },
  "capabilities": {
    "file_access": false,
    "code_execution": true,
    "web_search": true,
    "image_input": true,
    "image_generation": true,
    "long_documents": true
  },
  "updated_at": "2026-02-28T00:00:00Z"
}
